id,Time,language,similarity-score,url,title,fid_x,publisher,class,heads,relation,tails,inference,allinferences,heads-senti,senti-str-headline
399407754,2016-03-13 11:28:00+00:00,eng,0.4,http://www.ettelaat.com/index2.asp?code=endisplay&fname=%2Fettelaat%2Fetbupload%2Fdata%2F2016%2F03%2F03-13%2F4.htm&title=Putin%2520signs%2520decree%2520on%2520UN%2520Iran%2520resolution,Putin signs decree on UN Iran resolution,eng-1997119,ettelaat.com,sure-information-crossing,Putin signs decree on UN Iran resolution,isFilledBy. consists of . Effected. Reacted. want to. want to. It can be becuase. has sub event. becuase. Caused. Intended. needed. wanted. wanted. 0, a flag.  authoritative.  gets a new job.  happy.  PersonY asks for a copy of the decree..  PersonY asks for a copy of the decree..  Putin is not a lawyer..  read the decree.  read the decree.  the people of the world to know the truth.  to be a leader.  to be in charge of the country.  to protest against the resolution.  to sign the decree. 0,isFilledBy a flag. consists of  authoritative. Effected gets a new job. Reacted happy. want to PersonY asks for a copy of the decree.. want to PersonY asks for a copy of the decree.. It can be becuase Putin is not a lawyer.. has sub event read the decree. becuase read the decree. Caused the people of the world to know the truth. Intended to be a leader. needed to be in charge of the country. wanted to protest against the resolution. wanted to sign the decree. 0,Putin signs decree on UN Iran resolution. isFilledBy a flag. consists of  authoritative. Effected gets a new job. Reacted happy. want to PersonY asks for a copy of the decree.. want to PersonY asks for a copy of the decree.. It can be becuase Putin is not a lawyer.. has sub event read the decree. becuase read the decree. Caused the people of the world to know the truth. Intended to be a leader. needed to be in charge of the country. wanted to protest against the resolution. wanted to sign the decree. 0,0,The sentiment score is neutral
420005409,2016-04-16 06:27:00+00:00,eng,0.6,http://www.nrttv.com/EN/Details.aspx?Jimare=6358,"Pope heads to Lesbos, Greek front line of refugee crisis",eng-2082829,nrttv.com,sure-information-crossing,"Pope heads to Lesbos, Greek front line of refugee crisis",isFilledBy. Reacted. Effected. want to. becuase. want to. Caused. consists of . It can be becuase. Effected. Intended. needed. wanted. wanted. has sub event. 546, church.  happy.  is greeted by many people.  PersonX asks the pope to pray for them..  Pope Francis visits the front line of the refugee crisis.  Pope Francis visits the island of Lesbos.  Pope Francis visits the island of Lesbos in the middle of the refugee crisis..  religious.  The pope is not allowed to go to the front line of the crisis..  they get to know the people on the island.  to help.  to make a trip to the island.  to pray for the refugees.  to pray for the refugees.  visit the refugees. 546,isFilledBy church. Reacted happy. Effected is greeted by many people. want to PersonX asks the pope to pray for them.. becuase Pope Francis visits the front line of the refugee crisis. want to Pope Francis visits the island of Lesbos. Caused Pope Francis visits the island of Lesbos in the middle of the refugee crisis.. consists of  religious. It can be becuase The pope is not allowed to go to the front line of the crisis.. Effected they get to know the people on the island. Intended to help. needed to make a trip to the island. wanted to pray for the refugees. wanted to pray for the refugees. has sub event visit the refugees. 546,"Pope heads to Lesbos, Greek front line of refugee crisis. isFilledBy church. Reacted happy. Effected is greeted by many people. want to PersonX asks the pope to pray for them.. becuase Pope Francis visits the front line of the refugee crisis. want to Pope Francis visits the island of Lesbos. Caused Pope Francis visits the island of Lesbos in the middle of the refugee crisis.. consists of  religious. It can be becuase The pope is not allowed to go to the front line of the crisis.. Effected they get to know the people on the island. Intended to help. needed to make a trip to the island. wanted to pray for the refugees. wanted to pray for the refugees. has sub event visit the refugees. 546",-0.6249,The sentiment score is negative
570715494,2016-12-23 14:04:00+00:00,eng,0.7,http://www.vanguardngr.com/2016/12/man-thrown-off-plane-abusing-trumps-daughter-ivanka/,"Man thrown off plane for abusing Trump's daughter, Ivanka - Vanguard News",eng-2751486,vanguardngr.com,sure-information-crossing,"Man thrown off plane for abusing Trump's daughter, Ivanka - Vanguard News",Effected. Reacted. has sub event. want to. becuase. want to. Caused. It can be becuase. isFilledBy. needed. wanted. wanted. consists of . 533, gets thrown out of plane.  guilty.  man gets thrown off plane.  PersonX gets arrested.  PersonX gets arrested..  PersonX is arrested and sent to jail..  PersonX is in jail..  PersonX is not allowed on the plane..  plane.  to be on a plane.  to get away from the situation.  to go to jail.  violent. 533,Effected gets thrown out of plane. Reacted guilty. has sub event man gets thrown off plane. want to PersonX gets arrested. becuase PersonX gets arrested.. want to PersonX is arrested and sent to jail.. Caused PersonX is in jail.. It can be becuase PersonX is not allowed on the plane.. isFilledBy plane. needed to be on a plane. wanted to get away from the situation. wanted to go to jail. consists of  violent. 533,"Man thrown off plane for abusing Trump's daughter, Ivanka - Vanguard News. Effected gets thrown out of plane. Reacted guilty. has sub event man gets thrown off plane. want to PersonX gets arrested. becuase PersonX gets arrested.. want to PersonX is arrested and sent to jail.. Caused PersonX is in jail.. It can be becuase PersonX is not allowed on the plane.. isFilledBy plane. needed to be on a plane. wanted to get away from the situation. wanted to go to jail. consists of  violent. 533",-0.4588,The sentiment score is negative
571390900,2016-12-25 08:39:00+00:00,eng,0.8,http://sunnewsonline.com/trump-to-shut-down-his-charitable-foundation-to-avoid-conflict-of-interests/,Trump to shut down his charitable foundation to avoid conflict of interests,eng-2756228,sunnewsonline.com,sure-information-crossing,Trump to shut down his charitable foundation to avoid conflict of interests,becuase. Effected. Reacted. Caused. consists of . isFilledBy. It can be becuase. Intended. wanted. needed. want to. has sub event. want to. 291, get a new job.  gets sued.  good about themselves.  have less money.  immoral.  money.  they are too rich to not have a conflict of interest.  to avoid conflict of interest.  to find a new charity.  to make a decision.  to shut down his charitable foundation to avoid conflict of interests.  to shut down his charitable foundation to avoid conflict of interests.  to shut down his charitable foundation to avoid conflict of interests. 291,becuase get a new job. Effected gets sued. Reacted good about themselves. Caused have less money. consists of  immoral. isFilledBy money. It can be becuase they are too rich to not have a conflict of interest. Intended to avoid conflict of interest. wanted to find a new charity. needed to make a decision. want to to shut down his charitable foundation to avoid conflict of interests. has sub event to shut down his charitable foundation to avoid conflict of interests. want to to shut down his charitable foundation to avoid conflict of interests. 291,Trump to shut down his charitable foundation to avoid conflict of interests. becuase get a new job. Effected gets sued. Reacted good about themselves. Caused have less money. consists of  immoral. isFilledBy money. It can be becuase they are too rich to not have a conflict of interest. Intended to avoid conflict of interest. wanted to find a new charity. needed to make a decision. want to to shut down his charitable foundation to avoid conflict of interests. has sub event to shut down his charitable foundation to avoid conflict of interests. want to to shut down his charitable foundation to avoid conflict of interests. 291,0.0516,The sentiment score is positive
464669386,2016-06-28 06:20:00+00:00,eng,0.6,http://www.nigerianbestforum.com/blog/pope-asks-roman-catholics-to-apologise-to-gays/,Pope Asks Roman Catholics To Apologise To Gays,eng-2258612,nigerianbestforum.com,sure-information-crossing,Pope Asks Roman Catholics To Apologise To Gays,Reacted. isFilledBy. Effected. want to. want to. consists of . It can be becuase. becuase. Caused. has sub event. Intended. wanted. needed. wanted. 519, angry.  church.  gets yelled at.  PersonX is a gay man..  PersonX is a gay man..  repentant.  The pope is not a religious person..  the pope to apologize to the gay community.  the pope to apologize to the gay community.  to apologize to the gay community.  to apologize to the gay community.  to ask for forgiveness.  to be a priest.  to make amends. 519,Reacted angry. isFilledBy church. Effected gets yelled at. want to PersonX is a gay man.. want to PersonX is a gay man.. consists of  repentant. It can be becuase The pope is not a religious person.. becuase the pope to apologize to the gay community. Caused the pope to apologize to the gay community. has sub event to apologize to the gay community. Intended to apologize to the gay community. wanted to ask for forgiveness. needed to be a priest. wanted to make amends. 519,Pope Asks Roman Catholics To Apologise To Gays. Reacted angry. isFilledBy church. Effected gets yelled at. want to PersonX is a gay man.. want to PersonX is a gay man.. consists of  repentant. It can be becuase The pope is not a religious person.. becuase the pope to apologize to the gay community. Caused the pope to apologize to the gay community. has sub event to apologize to the gay community. Intended to apologize to the gay community. wanted to ask for forgiveness. needed to be a priest. wanted to make amends. 519,0.3818,The sentiment score is positive
465921759,2016-06-30 06:13:00+00:00,eng,0.6,http://www.tripolipost.com/articledetail.asp?c=1&i=11084,"Benghazi Report Criticizes US Government, Military for Less than Professional Conduct",eng-2260231,tripolipost.com,sure-information-crossing,"Benghazi Report Criticizes US Government, Military for Less than Professional Conduct",Reacted. want to. becuase. Caused. want to. It can be becuase. consists of . has sub event. isFilledBy. wanted. needed. wanted. 574, angry.  Benghazi report.  Benghazi report.  Benghazi report.  Benghazi report.  Benghazi report.  incompetent.  read the report.  report.  to protest against the report.  to read the report.  to write a book about it. 574,Reacted angry. want to Benghazi report. becuase Benghazi report. Caused Benghazi report. want to Benghazi report. It can be becuase Benghazi report. consists of  incompetent. has sub event read the report. isFilledBy report. wanted to protest against the report. needed to read the report. wanted to write a book about it. 574,"Benghazi Report Criticizes US Government, Military for Less than Professional Conduct. Reacted angry. want to Benghazi report. becuase Benghazi report. Caused Benghazi report. want to Benghazi report. It can be becuase Benghazi report. consists of  incompetent. has sub event read the report. isFilledBy report. wanted to protest against the report. needed to read the report. wanted to write a book about it. 574",-0.34,The sentiment score is negative
571451763,2016-12-25 12:32:00+00:00,eng,0.7,http://www.theindependentbd.com/post/73904,Trump says he intends to dissolve charitable foundation,eng-2756228,theindependentbd.com,sure-information-crossing,Trump says he intends to dissolve charitable foundation,has sub event. want to. Effected. Caused. becuase. consists of . isFilledBy. want to. Reacted. It can be becuase. needed. Intended. wanted. 25, get a new foundation.  get a new job.  gets sued.  he has to get rid of it.  he is going to get rid of the foundation.  mean.  money.  PersonX gets fired from the foundation..  sad.  The foundation is too important to the president..  to be president of the United States.  to get rid of charity.  to get rid of the foundation. 25,has sub event get a new foundation. want to get a new job. Effected gets sued. Caused he has to get rid of it. becuase he is going to get rid of the foundation. consists of  mean. isFilledBy money. want to PersonX gets fired from the foundation.. Reacted sad. It can be becuase The foundation is too important to the president.. needed to be president of the United States. Intended to get rid of charity. wanted to get rid of the foundation. 25,Trump says he intends to dissolve charitable foundation. has sub event get a new foundation. want to get a new job. Effected gets sued. Caused he has to get rid of it. becuase he is going to get rid of the foundation. consists of  mean. isFilledBy money. want to PersonX gets fired from the foundation.. Reacted sad. It can be becuase The foundation is too important to the president.. needed to be president of the United States. Intended to get rid of charity. wanted to get rid of the foundation. 25,0.4019,The sentiment score is positive
637366897,2017-04-16 11:10:00+00:00,eng,0.6,http://www.pakistantribune.com.pk/100-killed-blast-targets-evacuation-convoy-aleppo.html,100 Killed as Blast Targets Evacuation Convoy in Aleppo | Pakistan Tribune,eng-3054672,pakistantribune.com.pk,sure-information-crossing,100 Killed as Blast Targets Evacuation Convoy in Aleppo | Pakistan Tribune,want to. want to. It can be becuase. becuase. Caused. isFilledBy. has sub event. Effected. Reacted. consists of . needed. wanted. wanted. 600, 100 killed.  100 killed.  100 killed as blast targets Evacuation Convoy in Aleppo.  100 people dead.  100 people dead.  bomb.  get injured.  gets injured.  sad.  scared.  to be in a convoy.  to get out of the country.  to get to safety. 600,want to 100 killed. want to 100 killed. It can be becuase 100 killed as blast targets Evacuation Convoy in Aleppo. becuase 100 people dead. Caused 100 people dead. isFilledBy bomb. has sub event get injured. Effected gets injured. Reacted sad. consists of  scared. needed to be in a convoy. wanted to get out of the country. wanted to get to safety. 600,100 Killed as Blast Targets Evacuation Convoy in Aleppo | Pakistan Tribune. want to 100 killed. want to 100 killed. It can be becuase 100 killed as blast targets Evacuation Convoy in Aleppo. becuase 100 people dead. Caused 100 people dead. isFilledBy bomb. has sub event get injured. Effected gets injured. Reacted sad. consists of  scared. needed to be in a convoy. wanted to get out of the country. wanted to get to safety. 600,-0.6705,The sentiment score is negative
785913383,2017-12-30 02:55:00+00:00,eng,0.8,http://dunyanews.tv/en/World/421280-IS-claims-Saint-Petersburg-supermarket-bombing,IS claims Saint Petersburg supermarket bombing - World - Dunya News,eng-3673906,dunyanews.tv,sure-information-crossing,IS claims Saint Petersburg supermarket bombing - World - Dunya News,has sub event. Effected. Caused. isFilledBy. want to. becuase. It can be becuase. want to. Reacted. wanted. consists of . 662, get arrested.  gets arrested.  IS BLAMES THE STOREY MANUFACTURER FOR THE BOMBING.  IS claims responsibility for the attack.  IS claims responsibility for the attack.  IS IS IS IS IS IS IS IS IS IS IS IS IS IS IS IS IS IS IS IS IS IS.  IS IS IS IS IS IS IS IS IS IS IS IS IS IS IS IS IS IS IS IS IS IS.  IS IS IS IS IS IS IS IS IS IS IS IS IS IS IS IS IS IS IS IS IS IS.  sad.  to make a statement.  violent. 662,has sub event get arrested. Effected gets arrested. Caused IS BLAMES THE STOREY MANUFACTURER FOR THE BOMBING. isFilledBy IS claims responsibility for the attack. want to IS claims responsibility for the attack. becuase IS IS IS IS IS IS IS IS IS IS IS IS IS IS IS IS IS IS IS IS IS IS. It can be becuase IS IS IS IS IS IS IS IS IS IS IS IS IS IS IS IS IS IS IS IS IS IS. want to IS IS IS IS IS IS IS IS IS IS IS IS IS IS IS IS IS IS IS IS IS IS. Reacted sad. wanted to make a statement. consists of  violent. 662,IS claims Saint Petersburg supermarket bombing - World - Dunya News. has sub event get arrested. Effected gets arrested. Caused IS BLAMES THE STOREY MANUFACTURER FOR THE BOMBING. isFilledBy IS claims responsibility for the attack. want to IS claims responsibility for the attack. becuase IS IS IS IS IS IS IS IS IS IS IS IS IS IS IS IS IS IS IS IS IS IS. It can be becuase IS IS IS IS IS IS IS IS IS IS IS IS IS IS IS IS IS IS IS IS IS IS. want to IS IS IS IS IS IS IS IS IS IS IS IS IS IS IS IS IS IS IS IS IS IS. Reacted sad. wanted to make a statement. consists of  violent. 662,0,The sentiment score is neutral
785286966,2017-12-28 12:00:00+00:00,eng,0.5,https://www.thetrumpet.com/16691-how-japans-heiwaboke-peace-idiots-are-losing,How Japan's Heiwaboke--'Peace Idiots' -- Are Losing,eng-3673785,thetrumpet.com,sure-information-crossing,How Japan's Heiwaboke--'Peace Idiots' -- Are Losing,It can be becuase. want to. isFilledBy. want to. Caused. Reacted. consists of . wanted. wanted. 613, Heiwaboke is a pacifist..  Heiwaboke loses the war..  how to win a war.  how to win the war.  sad.  sad.  sadistic.  to win the war.  to win the war. 613,It can be becuase Heiwaboke is a pacifist.. want to Heiwaboke loses the war.. isFilledBy how to win a war. want to how to win the war. Caused sad. Reacted sad. consists of  sadistic. wanted to win the war. wanted to win the war. 613,How Japan's Heiwaboke--'Peace Idiots' -- Are Losing. It can be becuase Heiwaboke is a pacifist.. want to Heiwaboke loses the war.. isFilledBy how to win a war. want to how to win the war. Caused sad. Reacted sad. consists of  sadistic. wanted to win the war. wanted to win the war. 613,-0.3818,The sentiment score is negative
782302983,2017-12-22 05:31:00+00:00,eng,0.7,http://www.theindependentbd.com/post/129244,UK to warn Russia over cyber attacks,eng-3664419,theindependentbd.com,sure-information-crossing,UK to warn Russia over cyber attacks,Reacted. consists of . isFilledBy. Effected. want to. It can be becuase. needed. wanted. wanted. has sub event. Intended. want to. Caused. becuase. 622, angry.  angry.  computer.  gets called a liar.  PersonX is arrested by police.  Russia is not paying attention to what is going on in the world..  to know what is going on.  to warn others.  to warn others.  to warn Russia about cyber attacks.  to warn the world.  UK government to warn Russia about cyber attacks.  UK to warn Russia about cyber attacks.  UK to warn Russia about cyber attacks. 622,Reacted angry. consists of  angry. isFilledBy computer. Effected gets called a liar. want to PersonX is arrested by police. It can be becuase Russia is not paying attention to what is going on in the world.. needed to know what is going on. wanted to warn others. wanted to warn others. has sub event to warn Russia about cyber attacks. Intended to warn the world. want to UK government to warn Russia about cyber attacks. Caused UK to warn Russia about cyber attacks. becuase UK to warn Russia about cyber attacks. 622,UK to warn Russia over cyber attacks. Reacted angry. consists of  angry. isFilledBy computer. Effected gets called a liar. want to PersonX is arrested by police. It can be becuase Russia is not paying attention to what is going on in the world.. needed to know what is going on. wanted to warn others. wanted to warn others. has sub event to warn Russia about cyber attacks. Intended to warn the world. want to UK government to warn Russia about cyber attacks. Caused UK to warn Russia about cyber attacks. becuase UK to warn Russia about cyber attacks. 622,-0.5106,The sentiment score is negative
740065450,2017-10-09 16:12:00+00:00,eng,0.6,http://www.thepatrioticvanguard.com/liberian-presidential-election-who-will-win,Liberian presidential election: Who will win?{70},eng-3492052,thepatrioticvanguard.com,sure-information-crossing,Liberian presidential election: Who will win?{70},isFilledBy. consists of . Reacted. want to. It can be becuase. becuase. Caused. wanted. wanted. has sub event. 685, election.  hopeful.  hopeful.  PersonX wins the election..  The election is too close to call..  the winner of the election.  the winner of the election.  to win the election.  to win the election.  win the election. 685,isFilledBy election. consists of  hopeful. Reacted hopeful. want to PersonX wins the election.. It can be becuase The election is too close to call.. becuase the winner of the election. Caused the winner of the election. wanted to win the election. wanted to win the election. has sub event win the election. 685,Liberian presidential election: Who will win?{70}. isFilledBy election. consists of  hopeful. Reacted hopeful. want to PersonX wins the election.. It can be becuase The election is too close to call.. becuase the winner of the election. Caused the winner of the election. wanted to win the election. wanted to win the election. has sub event win the election. 685,0,The sentiment score is neutral
785405757,2017-12-29 08:43:00+00:00,eng,0.7,http://www.newspakistan.pk/2017/12/29/fire-engulfs-popular-restaurant-mumbai-killing-15-people/,Fire engulfs popular restaurant in Mumbai killing 15 people - News Pakistan,eng-3675219,newspakistan.pk,sure-information-crossing,Fire engulfs popular restaurant in Mumbai killing 15 people - News Pakistan,Effected. consists of . want to. isFilledBy. Caused. want to. It can be becuase. Effected. becuase. has sub event. needed. Reacted. wanted. wanted. 586, burns down building.  dangerous.  fire.  fire.  fire.  fire engulfs popular restaurant in Mumbai killing 15 people.  fire engulfs popular restaurant in Mumbai killing 15 people.  get injured.  get out of the building.  get out of the way.  go to the restaurant.  sad.  to get out of the building.  to get out of the building. 586,Effected burns down building. consists of  dangerous. want to fire. isFilledBy fire. Caused fire. want to fire engulfs popular restaurant in Mumbai killing 15 people. It can be becuase fire engulfs popular restaurant in Mumbai killing 15 people. Effected get injured. becuase get out of the building. has sub event get out of the way. needed go to the restaurant. Reacted sad. wanted to get out of the building. wanted to get out of the building. 586,Fire engulfs popular restaurant in Mumbai killing 15 people - News Pakistan. Effected burns down building. consists of  dangerous. want to fire. isFilledBy fire. Caused fire. want to fire engulfs popular restaurant in Mumbai killing 15 people. It can be becuase fire engulfs popular restaurant in Mumbai killing 15 people. Effected get injured. becuase get out of the building. has sub event get out of the way. needed go to the restaurant. Reacted sad. wanted to get out of the building. wanted to get out of the building. 586,-0.6124,The sentiment score is negative
797663940,2018-01-20 14:11:00+00:00,eng,0.6,https://kaplanherald.com/2018/01/20/brother-picks-up-cremated-stays-of-oct-1-gunman-2/,Brother picks up cremated stays of Oct. 1 gunman,eng-3710786,kaplanherald.com,sure-information-crossing,Brother picks up cremated stays of Oct. 1 gunman,becuase. Caused. isFilledBy. want to. want to. consists of . Reacted. It can be becuase. wanted. needed. 746, brother is in jail.  brother is in jail.  funeral.  PersonX is cremated..  PersonY is dead..  responsible.  sad.  The funeral home is closed..  to bury the dead.  to go to the funeral home. 746,becuase brother is in jail. Caused brother is in jail. isFilledBy funeral. want to PersonX is cremated.. want to PersonY is dead.. consists of  responsible. Reacted sad. It can be becuase The funeral home is closed.. wanted to bury the dead. needed to go to the funeral home. 746,Brother picks up cremated stays of Oct. 1 gunman. becuase brother is in jail. Caused brother is in jail. isFilledBy funeral. want to PersonX is cremated.. want to PersonY is dead.. consists of  responsible. Reacted sad. It can be becuase The funeral home is closed.. wanted to bury the dead. needed to go to the funeral home. 746,0,The sentiment score is neutral
