id,Time,language,similarity-score,url,title,fid_x,publisher,class,heads,relation,tails,inference,allinferences,heads-senti,senti-str-headline
6279604289,2020-11-02 16:46:00+00:00,eng,0.4,https://www.gq.com/story/trump-biden-election-polls,What If the Polls Are Wrong?,eng-6266488,gq.com,sure-information-crossing,What If the Polls Are Wrong?,isFilledBy. wanted. wanted. consists of . want to. becuase. want to. Caused. has sub event. Reacted. 2532, ballot box.  to find out if the polls are wrong.  to find out if the polls are wrong.  uncertain.  what if the polls are wrong.  what if the polls are wrong.  what if the polls are wrong.  what if the polls are wrong.  what if the polls are wrong.  worried. 2532,isFilledBy ballot box. wanted to find out if the polls are wrong. wanted to find out if the polls are wrong. consists of  uncertain. want to what if the polls are wrong. becuase what if the polls are wrong. want to what if the polls are wrong. Caused what if the polls are wrong. has sub event what if the polls are wrong. Reacted worried. 2532,What If the Polls Are Wrong?. isFilledBy ballot box. wanted to find out if the polls are wrong. wanted to find out if the polls are wrong. consists of  uncertain. want to what if the polls are wrong. becuase what if the polls are wrong. want to what if the polls are wrong. Caused what if the polls are wrong. has sub event what if the polls are wrong. Reacted worried. 2532,-0.4767,The sentiment score is negative
6330018936,2020-12-05 11:39:00+00:00,eng,0.7,https://abcnews.go.com/International/wireStory/uk-police-release-men-bail-liverpool-bribery-probe-74554049,UK police release men on bail in Liverpool bribery probe,eng-6366510,abcnews.go.com,sure-information-crossing,UK police release men on bail in Liverpool bribery probe,consists of . Effected. Effected. has sub event. Reacted. isFilledBy. Intended. needed. wanted. wanted. 2542, criminal.  get out of jail.  get out of jail.  get out of jail.  happy.  police car.  to be free.  to get a warrant for the men's arrest.  to go back to work.  to go home. 2542,consists of  criminal. Effected get out of jail. Effected get out of jail. has sub event get out of jail. Reacted happy. isFilledBy police car. Intended to be free. needed to get a warrant for the men's arrest. wanted to go back to work. wanted to go home. 2542,UK police release men on bail in Liverpool bribery probe. consists of  criminal. Effected get out of jail. Effected get out of jail. has sub event get out of jail. Reacted happy. isFilledBy police car. Intended to be free. needed to get a warrant for the men's arrest. wanted to go back to work. wanted to go home. 2542,0,The sentiment score is neutral
6331579214,2020-12-06 19:04:00+00:00,eng,0.7,https://www.courthousenews.com/last-ditch-post-brexit-trade-talks-to-resume-between-eu-uk/,"Last-Ditch Post-Brexit Trade Talks to Resume Between EU, UK",eng-6369188,courthousenews.com,sure-information-crossing,"Last-Ditch Post-Brexit Trade Talks to Resume Between EU, UK",becuase. Effected. has sub event. Reacted. consists of . It can be becuase. needed. Intended. wanted. wanted. isFilledBy. want to. want to. Caused. 2552, get a deal done.  get a new trade deal.  get a new trade deal.  happy.  hard-working.  last-ditch post-Brexit trade talks.  negotiate with the other side.  to get a deal.  to make a deal.  to make a deal with the UK.  trade agreement.  trade talks to resume.  trade talks to resume.  trade talks to resume. 2552,becuase get a deal done. Effected get a new trade deal. has sub event get a new trade deal. Reacted happy. consists of  hard-working. It can be becuase last-ditch post-Brexit trade talks. needed negotiate with the other side. Intended to get a deal. wanted to make a deal. wanted to make a deal with the UK. isFilledBy trade agreement. want to trade talks to resume. want to trade talks to resume. Caused trade talks to resume. 2552,"Last-Ditch Post-Brexit Trade Talks to Resume Between EU, UK. becuase get a deal done. Effected get a new trade deal. has sub event get a new trade deal. Reacted happy. consists of  hard-working. It can be becuase last-ditch post-Brexit trade talks. needed negotiate with the other side. Intended to get a deal. wanted to make a deal. wanted to make a deal with the UK. isFilledBy trade agreement. want to trade talks to resume. want to trade talks to resume. Caused trade talks to resume. 2552",0,The sentiment score is neutral
6336683234,2020-12-09 23:45:00+00:00,eng,0.5,https://www.politico.com/news/2020/12/09/trump-texas-election-results-444014,Trump looks to jump into Texas case to overturn election results,eng-6376987,politico.com,sure-information-crossing,Trump looks to jump into Texas case to overturn election results,consists of . has sub event. Effected. isFilledBy. want to. want to. Reacted. Caused. needed. wanted. Intended. wanted. becuase. It can be becuase. 2566, aggressive.  get a lawyer.  gets sued.  lawyer.  PersonX wins the case..  PersonX wins the election..  powerful.  the election results to be changed.  to be in charge of the case.  to win the case.  to win the case.  to win the case.  Trump is a lawyer..  Trump is not a lawyer.. 2566,consists of  aggressive. has sub event get a lawyer. Effected gets sued. isFilledBy lawyer. want to PersonX wins the case.. want to PersonX wins the election.. Reacted powerful. Caused the election results to be changed. needed to be in charge of the case. wanted to win the case. Intended to win the case. wanted to win the case. becuase Trump is a lawyer.. It can be becuase Trump is not a lawyer.. 2566,Trump looks to jump into Texas case to overturn election results. consists of  aggressive. has sub event get a lawyer. Effected gets sued. isFilledBy lawyer. want to PersonX wins the case.. want to PersonX wins the election.. Reacted powerful. Caused the election results to be changed. needed to be in charge of the case. wanted to win the case. Intended to win the case. wanted to win the case. becuase Trump is a lawyer.. It can be becuase Trump is not a lawyer.. 2566,0,The sentiment score is neutral
6338121363,2020-12-10 19:55:00+00:00,eng,0.5,http://www.cna.org.cy/webphoto.aspx?a=2ae79e3f949341b98147eae293cb18f7,Brandon Bernard federal execution,eng-6381893,cna.org.cy,sure-information-crossing,Brandon Bernard federal execution,Caused. becuase. want to. has sub event. Effected. Reacted. want to. isFilledBy. needed. Intended. wanted. wanted. consists of . It can be becuase. 2580, criminal.  death penalty.  death row.  get sentenced to death.  gets sentenced to death.  guilty.  prison.  prison.  to be convicted of a crime.  to be executed.  to get rid of him.  to go to prison.  violent. Brandon Bernard is not a criminal.. 2580,Caused criminal. becuase death penalty. want to death row. has sub event get sentenced to death. Effected gets sentenced to death. Reacted guilty. want to prison. isFilledBy prison. needed to be convicted of a crime. Intended to be executed. wanted to get rid of him. wanted to go to prison. consists of  violent. It can be becuaseBrandon Bernard is not a criminal.. 2580,Brandon Bernard federal execution. Caused criminal. becuase death penalty. want to death row. has sub event get sentenced to death. Effected gets sentenced to death. Reacted guilty. want to prison. isFilledBy prison. needed to be convicted of a crime. Intended to be executed. wanted to get rid of him. wanted to go to prison. consists of  violent. It can be becuaseBrandon Bernard is not a criminal.. 2580,0,The sentiment score is neutral
6343810727,2020-12-14 22:55:00+00:00,eng,0.4,https://azcapitoltimes.com/news/2020/12/14/electors-vote-as-lawmakers-hold-hearing-on-election/,Electors vote as lawmakers hold hearing on election,eng-6395642,azcapitoltimes.com,sure-information-crossing,Electors vote as lawmakers hold hearing on election,isFilledBy. want to. becuase. want to. Caused. has sub event. Effected. Effected. consists of . Reacted. It can be becuase. Intended. needed. wanted. wanted. 2594, ballot box.  elects.  elects.  elects.  elects.  elects a new president.  elects new members of congress.  elects new members of congress.  responsible.  satisfied.  The election is over..  to be heard.  to go to the hearing.  to make a report.  to make a report. 2594,isFilledBy ballot box. want to elects. becuase elects. want to elects. Caused elects. has sub event elects a new president. Effected elects new members of congress. Effected elects new members of congress. consists of  responsible. Reacted satisfied. It can be becuase The election is over.. Intended to be heard. needed to go to the hearing. wanted to make a report. wanted to make a report. 2594,Electors vote as lawmakers hold hearing on election. isFilledBy ballot box. want to elects. becuase elects. want to elects. Caused elects. has sub event elects a new president. Effected elects new members of congress. Effected elects new members of congress. consists of  responsible. Reacted satisfied. It can be becuase The election is over.. Intended to be heard. needed to go to the hearing. wanted to make a report. wanted to make a report. 2594,0,The sentiment score is neutral
6343820919,2020-12-14 23:07:00+00:00,eng,0.7,https://www.nwherald.com/2020/12/14/trump-says-barr-resigning-will-leave-before-christmas/a2l8myl/,"Trump says Barr resigning, will leave before Christmas",eng-6396583,nwherald.com,sure-information-crossing,"Trump says Barr resigning, will leave before Christmas",consists of . has sub event. becuase. want to. Effected. Caused. It can be becuase. isFilledBy. want to. Reacted. wanted. wanted. needed. 2609, angry.  get a new job.  get a new job.  get a new job.  get a new job.  he gets a new job.  he will be fired.  office.  PersonY asks why PersonY is resigning..  relieved.  to get a new job.  to get a new job.  to have a meeting with the president. 2609,consists of  angry. has sub event get a new job. becuase get a new job. want to get a new job. Effected get a new job. Caused he gets a new job. It can be becuase he will be fired. isFilledBy office. want to PersonY asks why PersonY is resigning.. Reacted relieved. wanted to get a new job. wanted to get a new job. needed to have a meeting with the president. 2609,"Trump says Barr resigning, will leave before Christmas. consists of  angry. has sub event get a new job. becuase get a new job. want to get a new job. Effected get a new job. Caused he gets a new job. It can be becuase he will be fired. isFilledBy office. want to PersonY asks why PersonY is resigning.. Reacted relieved. wanted to get a new job. wanted to get a new job. needed to have a meeting with the president. 2609",-0.2732,The sentiment score is negative
6367107162,2020-12-30 21:21:00+00:00,eng,0.7,http://dailycallernewsfoundation.org/2020/12/30/biden-names-first-ever-female-deputy-secretary-of-defense/,Biden Names First-Ever Female Deputy Secretary Of Defense,eng-6438081,dailycallernewsfoundation.org,sure-information-crossing,Biden Names First-Ever Female Deputy Secretary Of Defense,consists of . isFilledBy. has sub event. Effected. It can be becuase. Caused. want to. want to. becuase. Reacted. wanted. Intended. needed. wanted. 2622, brave.  cabinet.  get a new job.  has a female in his cabinet.  PersonX is not qualified for the position..  PersonY is not qualified for the position..  PersonY is sworn in as the new secretary of defense.  PersonY is the first female to serve in the military..  PersonY is the first female to serve in the military..  proud.  to appoint a female to the position.  to be a leader.  to interview for the position.  to work with the new person. 2622,consists of  brave. isFilledBy cabinet. has sub event get a new job. Effected has a female in his cabinet. It can be becuase PersonX is not qualified for the position.. Caused PersonY is not qualified for the position.. want to PersonY is sworn in as the new secretary of defense. want to PersonY is the first female to serve in the military.. becuase PersonY is the first female to serve in the military.. Reacted proud. wanted to appoint a female to the position. Intended to be a leader. needed to interview for the position. wanted to work with the new person. 2622,Biden Names First-Ever Female Deputy Secretary Of Defense. consists of  brave. isFilledBy cabinet. has sub event get a new job. Effected has a female in his cabinet. It can be becuase PersonX is not qualified for the position.. Caused PersonY is not qualified for the position.. want to PersonY is sworn in as the new secretary of defense. want to PersonY is the first female to serve in the military.. becuase PersonY is the first female to serve in the military.. Reacted proud. wanted to appoint a female to the position. Intended to be a leader. needed to interview for the position. wanted to work with the new person. 2622,0.128,The sentiment score is positive
6224897197,2020-09-19 22:23:00+00:00,eng,0.4,https://www.ithacajournal.com/story/news/local/2020/09/19/rbg-supreme-court-ruth-bader-ginsburg-graduate-cornell-1954-five-ways-made-difference/5841271002/,RBG: Supreme Court Justice Ruth Bader Ginsburg remembered as female pioneer at Cornell,eng-6138079,ithacajournal.com,sure-information-crossing,RBG: Supreme Court Justice Ruth Bader Ginsburg remembered as female pioneer at Cornell,isFilledBy. Effected. want to. Caused. Reacted. consists of . want to. It can be becuase. wanted. has sub event. 2636, a book.  is remembered as a pioneer.  PersonX tells the story of Ruth Bader Ginsburg.  proud.  proud.  proud.  The New York Times.  They don't want to be remembered as a pioneer..  to be remembered.  to be remembered as a pioneer. 2636,isFilledBy a book. Effected is remembered as a pioneer. want to PersonX tells the story of Ruth Bader Ginsburg. Caused proud. Reacted proud. consists of  proud. want to The New York Times. It can be becuase They don't want to be remembered as a pioneer.. wanted to be remembered. has sub event to be remembered as a pioneer. 2636,RBG: Supreme Court Justice Ruth Bader Ginsburg remembered as female pioneer at Cornell. isFilledBy a book. Effected is remembered as a pioneer. want to PersonX tells the story of Ruth Bader Ginsburg. Caused proud. Reacted proud. consists of  proud. want to The New York Times. It can be becuase They don't want to be remembered as a pioneer.. wanted to be remembered. has sub event to be remembered as a pioneer. 2636,0.7906,The sentiment score is positive
6241632354,2020-10-02 21:37:00+00:00,eng,0.8,https://www.thenorthernview.com/news/trump-to-spend-a-few-days-at-military-hospital-amid-testing-positive-for-covid-19/,Trump to spend a 'few days' at military hospital amid testing positive for COVID-19 - Prince Rupert Northern View,eng-6174696,thenorthernview.com,sure-information-crossing,Trump to spend a 'few days' at military hospital amid testing positive for COVID-19 - Prince Rupert Northern View,Effected. becuase. want to. has sub event. want to. isFilledBy. It can be becuase. consists of . Caused. Reacted. needed. wanted. wanted. 2672, get medical treatment.  get medical treatment.  get medical treatment at military hospital.  have to go to the hospital.  health care.  medicine chest.  President Trump is being treated at a military hospital..  sick.  sick.  sick.  to be in the military.  to get better.  to get better. 2672,Effected get medical treatment. becuase get medical treatment. want to get medical treatment at military hospital. has sub event have to go to the hospital. want to health care. isFilledBy medicine chest. It can be becuase President Trump is being treated at a military hospital.. consists of  sick. Caused sick. Reacted sick. needed to be in the military. wanted to get better. wanted to get better. 2672,Trump to spend a 'few days' at military hospital amid testing positive for COVID-19 - Prince Rupert Northern View. Effected get medical treatment. becuase get medical treatment. want to get medical treatment at military hospital. has sub event have to go to the hospital. want to health care. isFilledBy medicine chest. It can be becuase President Trump is being treated at a military hospital.. consists of  sick. Caused sick. Reacted sick. needed to be in the military. wanted to get better. wanted to get better. 2672,0.5574,The sentiment score is positive
6360446556,2020-12-25 23:54:00+00:00,eng,0.8,https://www.crestonvalleyadvance.ca/news/explosion-rattles-downtown-nashville-knocks-communications-offline/,"Explosion rattles downtown Nashville, knocks communications offline - Creston Valley Advance",eng-6428381,crestonvalleyadvance.ca,sure-information-crossing,"Explosion rattles downtown Nashville, knocks communications offline - Creston Valley Advance",needed. has sub event. Effected. Caused. isFilledBy. becuase. want to. It can be becuase. want to. Reacted. wanted. wanted. consists of . 2700, find out what happened.  get out of the way.  gets injured.  hurt.  news.  Person dies in the explosion..  PersonX is injured in the explosion..  PersonX is not in the area of the explosion..  PersonX was injured in the explosion..  scared.  to find out what is going on.  to find out what's going on.  violent. 2700,needed find out what happened. has sub event get out of the way. Effected gets injured. Caused hurt. isFilledBy news. becuase Person dies in the explosion.. want to PersonX is injured in the explosion.. It can be becuase PersonX is not in the area of the explosion.. want to PersonX was injured in the explosion.. Reacted scared. wanted to find out what is going on. wanted to find out what's going on. consists of  violent. 2700,"Explosion rattles downtown Nashville, knocks communications offline - Creston Valley Advance. needed find out what happened. has sub event get out of the way. Effected gets injured. Caused hurt. isFilledBy news. becuase Person dies in the explosion.. want to PersonX is injured in the explosion.. It can be becuase PersonX is not in the area of the explosion.. want to PersonX was injured in the explosion.. Reacted scared. wanted to find out what is going on. wanted to find out what's going on. consists of  violent. 2700",-0.128,The sentiment score is negative
6264763522,2020-10-21 17:27:00+00:00,eng,0.6,https://www.irishcatholic.com/pope-francis-wants-to-offer-legal-protection-to-gay-couples-while-upholding-marriage/,Pope Francis wants to support legal protection to gay couples while upholding marriage - The Irish Catholic,eng-6230198,irishcatholic.com,sure-information-crossing,Pope Francis wants to support legal protection to gay couples while upholding marriage - The Irish Catholic,isFilledBy. Reacted. want to. becuase. consists of . Caused. want to. It can be becuase. wanted. wanted. Intended. needed. 2713, church.  happy.  Pope Francis.  Pope Francis is a gay man..  religious.  religious.  The Irish Catholic.  The Irish Catholic does not support same sex marriage..  to be a good person.  to be a good person.  to be a good person.  to be a priest. 2713,isFilledBy church. Reacted happy. want to Pope Francis. becuase Pope Francis is a gay man.. consists of  religious. Caused religious. want to The Irish Catholic. It can be becuase The Irish Catholic does not support same sex marriage.. wanted to be a good person. wanted to be a good person. Intended to be a good person. needed to be a priest. 2713,Pope Francis wants to support legal protection to gay couples while upholding marriage - The Irish Catholic. isFilledBy church. Reacted happy. want to Pope Francis. becuase Pope Francis is a gay man.. consists of  religious. Caused religious. want to The Irish Catholic. It can be becuase The Irish Catholic does not support same sex marriage.. wanted to be a good person. wanted to be a good person. Intended to be a good person. needed to be a priest. 2713,0.4939,The sentiment score is positive
6324217195,2020-12-01 19:00:00+00:00,eng,0.7,https://www.cityam.com/four-killed-including-baby/,"Four killed, including baby, as car ploughs into pedestrian zone in Germany - CityAM",eng-6354767,cityam.com,sure-information-crossing,"Four killed, including baby, as car ploughs into pedestrian zone in Germany - CityAM",isFilledBy. consists of . want to. becuase. want to. Caused. needed. has sub event. wanted. wanted. It can be becuase. Reacted. 2725, car.  dangerous.  four dead and one injured.  four dead and one injured.  four dead and one injured.  four people dead.  get in car.  get injured.  get out of the car.  go to hospital.  PersonX is driving the car..  sad. 2725,isFilledBy car. consists of  dangerous. want to four dead and one injured. becuase four dead and one injured. want to four dead and one injured. Caused four people dead. needed get in car. has sub event get injured. wanted get out of the car. wanted go to hospital. It can be becuase PersonX is driving the car.. Reacted sad. 2725,"Four killed, including baby, as car ploughs into pedestrian zone in Germany - CityAM. isFilledBy car. consists of  dangerous. want to four dead and one injured. becuase four dead and one injured. want to four dead and one injured. Caused four people dead. needed get in car. has sub event get injured. wanted get out of the car. wanted go to hospital. It can be becuase PersonX is driving the car.. Reacted sad. 2725",-0.6705,The sentiment score is negative
6347904990,2020-12-17 12:03:00+00:00,eng,0.5,https://www.thevisitor.co.uk/news/politics/lancashire-stay-tier-3-lockdown-until-next-year-confirms-government-3071286,"Lancashire to stay in Tier 3 lockdown until next year, confirms Government",eng-6402061,thevisitor.co.uk,sure-information-crossing,"Lancashire to stay in Tier 3 lockdown until next year, confirms Government",isFilledBy. want to. Caused. becuase. want to. consists of . Reacted. It can be becuase. needed. wanted. wanted. has sub event. 2737, lancashire.  lancashire to stay in lockdown.  lancashire to stay in lockdown until next year.  lancashire to stay in Tier 3 lockdown until next year.  lancashire to stay in Tier 3 lockdown until next year.  scared.  scared.  The lockdown is too long..  to be in a lockdown.  to make sure everyone is safe.  to make sure they are safe.  to stay in lockdown until next year. 2737,isFilledBy lancashire. want to lancashire to stay in lockdown. Caused lancashire to stay in lockdown until next year. becuase lancashire to stay in Tier 3 lockdown until next year. want to lancashire to stay in Tier 3 lockdown until next year. consists of  scared. Reacted scared. It can be becuase The lockdown is too long.. needed to be in a lockdown. wanted to make sure everyone is safe. wanted to make sure they are safe. has sub event to stay in lockdown until next year. 2737,"Lancashire to stay in Tier 3 lockdown until next year, confirms Government. isFilledBy lancashire. want to lancashire to stay in lockdown. Caused lancashire to stay in lockdown until next year. becuase lancashire to stay in Tier 3 lockdown until next year. want to lancashire to stay in Tier 3 lockdown until next year. consists of  scared. Reacted scared. It can be becuase The lockdown is too long.. needed to be in a lockdown. wanted to make sure everyone is safe. wanted to make sure they are safe. has sub event to stay in lockdown until next year. 2737",0,The sentiment score is neutral
6273780861,2020-10-28 22:26:00+00:00,eng,0.4,http://www.thepatrioticvanguard.com/biden-versus-trump-who-will-win,Biden versus Trump: Who will win?{70},eng-6251363,thepatrioticvanguard.com,sure-information-crossing,Biden versus Trump: Who will win?{70},It can be becuase. Caused. becuase. consists of . Reacted. want to. want to. isFilledBy. wanted. wanted. has sub event. Effected. 2749, Biden is not a good candidate..  BILLION.  BILLIONION DOLLARS.  competitive.  happy.  PersonX votes for PersonY..  PersonX votes for PersonY..  the election.  to win the election.  to win the election.  win the election.  wins the election. 2749,It can be becuase Biden is not a good candidate.. Caused BILLION. becuase BILLIONION DOLLARS. consists of  competitive. Reacted happy. want to PersonX votes for PersonY.. want to PersonX votes for PersonY.. isFilledBy the election. wanted to win the election. wanted to win the election. has sub event win the election. Effected wins the election. 2749,Biden versus Trump: Who will win?{70}. It can be becuase Biden is not a good candidate.. Caused BILLION. becuase BILLIONION DOLLARS. consists of  competitive. Reacted happy. want to PersonX votes for PersonY.. want to PersonX votes for PersonY.. isFilledBy the election. wanted to win the election. wanted to win the election. has sub event win the election. Effected wins the election. 2749,0,The sentiment score is neutral
